{
  "instance_id": "mymachine",
  "service_conf_dir": "example/nerve_services",
  "max_repeated_report_failures": 10,
  "statsd": {
    "host": "localhost",
    "port": 8125
  },
  "prometheus": {
    "enabled": true,
    "port": 9292,
    "bind": "0.0.0.0",
    "histogram_buckets_zk": [0.001, 0.005, 0.01, 0.025, 0.05, 0.1, 0.25, 0.5, 1.0, 2.5, 5.0, 10.0],
    "histogram_buckets_main_loop": [0.001, 0.01, 0.1, 0.5, 1.0, 2.5, 5.0, 10.0, 30.0]
  },
  "services": {
    "your_http_service": {
      "host": "1.2.3.4",
      "port": 3000,
      "reporter_type": "zookeeper",
      "zk_hosts": ["localhost:2181"],
      "zk_path": "/nerve/services/your_http_service/services",
      "check_interval": 2,
      "checks": [
        {
          "type": "http",
          "uri": "/health",
          "timeout": 0.2,
          "rise": 3,
          "fall": 2
        }
      ]
    },
    "your_tcp_service": {
      "host": "1.2.3.4",
      "port": 6379,
      "reporter_type": "zookeeper",
      "zk_hosts": ["localhost:2181"],
      "zk_path": "/nerve/services/your_tcp_service/services",
      "check_interval": 2,
      "checks": [
        {
          "type": "tcp",
          "timeout": 0.2,
          "rise": 3,
          "fall": 2
        }
      ]
    },
    "rabbitmq_service": {
      "host": "1.2.3.4",
      "port": 5672,
      "reporter_type": "zookeeper",
      "zk_hosts": ["localhost:2181"],
      "zk_path": "/nerve/services/your_rabbitmq_service/services",
      "check_interval": 2,
      "checks": [
        {
          "type": "rabbitmq",
          "username": "guest",
          "password": "guest"
        }
      ]
    }
  }
}
